{
  "commandType": "CreateAnnotation",
  "workspaceId": "11111111-1111-4111-8111-111111111111",
  "correlationId": "22222222-2222-4222-8222-222222222222",
  "idempotencyKey": "anno-field-1",
  "payload": {
    "targetType": "field",
    "targetId": "33333333-3333-4333-8333-333333333331",
    "fieldCode": "budget",
    "anchoredDataVersion": 3,
    "severity": "issue",
    "body": "预算高于上限"
  }
}
