{
  "commandType": "CreateAnnotation",
  "workspaceId": "11111111-1111-4111-8111-111111111111",
  "correlationId": "22222222-2222-4222-8222-222222222222",
  "idempotencyKey": "anno-object-1",
  "payload": {
    "targetType": "object",
    "targetId": "33333333-3333-4333-8333-333333333331",
    "anchoredDataVersion": 5,
    "severity": "suggest",
    "body": "建议补充验收标准"
  }
}
